### ISSUE TITLE
deepflow lost sql statement when using  gorm.io/gorm v1.22.4

### ISSUE THREAD

**Issue by withlin** [deepflowys/deepflow#515]
## Info
```
NAME             STATUS   ROLES                       AGE   VERSION   INTERNAL-IP      EXTERNAL-IP   OS-IMAGE             KERNEL-VERSION     CONTAINER-RUNTIME
10-102-119-109   Ready    worker                      8h    v1.20.7   10.102.119.109   <none>        Ubuntu 20.04.2 LTS   5.4.0-72-generic   docker://20.10.8

```

### tcp dump
```
app-profile-7c9457bb6c-trn4x:~# tcpdump -i eth0 dst  port 3306 -vvvvv
tcpdump: listening on eth0, link-type EN10MB (Ethernet), snapshot length 262144 bytes
12:02:38.235223 IP (tos 0x0, ttl 64, id 50553, offset 0, flags [DF], proto TCP (6), length 114)
    app-profile-7c9457bb6c-trn4x.60966 > 172.16.58.14.3306: Flags [P.], cksum 0xf59c (incorrect -> 0xf281), seq 3807471271:3807471345, ack 94817439, win 501, length 74
12:02:38.235897 IP (tos 0x0, ttl 64, id 50554, offset 0, flags [DF], proto TCP (6), length 40)
    app-profile-7c9457bb6c-trn4x.60966 > 172.16.58.14.3306: Flags [.], cksum 0xf552 (incorrect -> 0x9cb3), seq 74, ack 1211, win 501, length 0
12:02:38.235997 IP (tos 0x0, ttl 64, id 50555, offset 0, flags [DF], proto TCP (6), length 82)
    app-profile-7c9457bb6c-trn4x.60966 > 172.16.58.14.3306: Flags [P.], cksum 0xf57c (incorrect -> 0xfb83), seq 74:116, ack 1211, win 501, length 42
12:02:38.236664 IP (tos 0x0, ttl 64, id 50556, offset 0, flags [DF], proto TCP (6), length 40)
    app-profile-7c9457bb6c-trn4x.60966 > 172.16.58.14.3306: Flags [.], cksum 0xf552 (incorrect -> 0x9810), seq 116, ack 2356, win 501, length 0
12:02:38.236757 IP (tos 0x0, ttl 64, id 50557, offset 0, flags [DF], proto TCP (6), length 49)
    app-profile-7c9457bb6c-trn4x.60966 > 172.16.58.14.3306: Flags [P.], cksum 0xf55b (incorrect -> 0x79fc), seq 116:125, ack 2356, win 501, length 9
12:02:38.236911 IP (tos 0x0, ttl 64, id 50558, offset 0, flags [DF], proto TCP (6), length 114)
    app-profile-7c9457bb6c-trn4x.60966 > 172.16.58.14.3306: Flags [P.], cksum 0xf59c (incorrect -> 0xe8d1), seq 125:199, ack 2356, win 501, length 74
12:02:38.237526 IP (tos 0x0, ttl 64, id 50559, offset 0, flags [DF], proto TCP (6), length 40)
    app-profile-7c9457bb6c-trn4x.60966 > 172.16.58.14.3306: Flags [.], cksum 0xf552 (incorrect -> 0x9303), seq 199, ack 3566, win 501, length 0
12:02:38.237660 IP (tos 0x0, ttl 64, id 50560, offset 0, flags [DF], proto TCP (6), length 82)
    app-profile-7c9457bb6c-trn4x.60966 > 172.16.58.14.3306: Flags [P.], cksum 0xf57c (incorrect -> 0xf2d2), seq 199:241, ack 3566, win 501, length 42
12:02:38.238349 IP (tos 0x0, ttl 64, id 50561, offset 0, flags [DF], proto TCP (6), length 40)
    app-profile-7c9457bb6c-trn4x.60966 > 172.16.58.14.3306: Flags [.], cksum 0xf552 (incorrect -> 0x8e60), seq 241, ack 4711, win 501, length 0
12:02:38.238479 IP (tos 0x0, ttl 64, id 50562, offset 0, flags [DF], proto TCP (6), length 49)
    app-profile-7c9457bb6c-trn4x.60966 > 172.16.58.14.3306: Flags [P.], cksum 0xf55b (incorrect -> 0x704b), seq 241:250, ack 4711, win 501, length 9
12:02:43.239446 IP (tos 0x0, ttl 64, id 50563, offset 0, flags [DF], proto TCP (6), length 45)
    app-profile-7c9457bb6c-trn4x.60966 > 172.16.58.14.3306: Flags [P.], cksum 0xf557 (incorrect -> 0x8c4a), seq 250:255, ack 4711, win 501, length 5
12:02:43.239635 IP (tos 0x0, ttl 64, id 50564, offset 0, flags [DF], proto TCP (6), length 40)
    app-profile-7c9457bb6c-trn4x.60966 > 172.16.58.14.3306: Flags [F.], cksum 0xf552 (incorrect -> 0x8e51), seq 255, ack 4711, win 501, length 0
12:02:43.239790 IP (tos 0x0, ttl 64, id 32723, offset 0, flags [DF], proto TCP (6), length 60)
    app-profile-7c9457bb6c-trn4x.32782 > 172.16.58.14.3306: Flags [S], cksum 0xf566 (incorrect -> 0xe23d), seq 1047319603, win 64800, options [mss 1440,sackOK,TS val 2114737624 ecr 0,nop,wscale 7], length 0
12:02:43.240205 IP (tos 0x0, ttl 64, id 50565, offset 0, flags [DF], proto TCP (6), length 40)
    app-profile-7c9457bb6c-trn4x.60966 > 172.16.58.14.3306: Flags [.], cksum 0xf552 (incorrect -> 0x8e50), seq 256, ack 4712, win 501, length 0
12:02:43.240601 IP (tos 0x0, ttl 64, id 32724, offset 0, flags [DF], proto TCP (6), length 40)
    app-profile-7c9457bb6c-trn4x.32782 > 172.16.58.14.3306: Flags [.], cksum 0xf552 (incorrect -> 0xe6d8), seq 1047319604, ack 2683540027, win 507, length 0
12:02:43.241463 IP (tos 0x0, ttl 64, id 32725, offset 0, flags [DF], proto TCP (6), length 40)
    app-profile-7c9457bb6c-trn4x.32782 > 172.16.58.14.3306: Flags [.], cksum 0xf552 (incorrect -> 0xe681), seq 0, ack 88, win 507, length 0
12:02:43.241548 IP (tos 0x0, ttl 64, id 32726, offset 0, flags [DF], proto TCP (6), length 127)
    app-profile-7c9457bb6c-trn4x.32782 > 172.16.58.14.3306: Flags [P.], cksum 0xf5a9 (incorrect -> 0x61ab), seq 0:87, ack 88, win 507, length 87
12:02:43.242333 IP (tos 0x0, ttl 64, id 32727, offset 0, flags [DF], proto TCP (6), length 40)
    app-profile-7c9457bb6c-trn4x.32782 > 172.16.58.14.3306: Flags [.], cksum 0xf552 (incorrect -> 0xe61f), seq 87, ack 99, win 507, length 0
12:02:43.242419 IP (tos 0x0, ttl 64, id 32728, offset 0, flags [DF], proto TCP (6), length 62)
    app-profile-7c9457bb6c-trn4x.32782 > 172.16.58.14.3306: Flags [P.], cksum 0xf568 (incorrect -> 0xb4ee), seq 87:109, ack 99, win 507, length 22
12:02:43.243173 IP (tos 0x0, ttl 64, id 32729, offset 0, flags [DF], proto TCP (6), length 40)
    app-profile-7c9457bb6c-trn4x.32782 > 172.16.58.14.3306: Flags [.], cksum 0xf552 (incorrect -> 0xe5fe), seq 109, ack 110, win 507, length 0
12:02:43.243273 IP (tos 0x0, ttl 64, id 32730, offset 0, flags [DF], proto TCP (6), length 114)
    app-profile-7c9457bb6c-trn4x.32782 > 172.16.58.14.3306: Flags [P.], cksum 0xf59c (incorrect -> 0x36c9), seq 109:183, ack 110, win 507, length 74
12:02:43.244089 IP (tos 0x0, ttl 64, id 32731, offset 0, flags [DF], proto TCP (6), length 40)
    app-profile-7c9457bb6c-trn4x.32782 > 172.16.58.14.3306: Flags [.], cksum 0xf552 (incorrect -> 0xe100), seq 183, ack 1320, win 501, length 0
12:02:43.244179 IP (tos 0x0, ttl 64, id 32732, offset 0, flags [DF], proto TCP (6), length 82)
    app-profile-7c9457bb6c-trn4x.32782 > 172.16.58.14.3306: Flags [P.], cksum 0xf57c (incorrect -> 0x3fd3), seq 183:225, ack 1320, win 501, length 42
12:02:43.245063 IP (tos 0x0, ttl 64, id 32733, offset 0, flags [DF], proto TCP (6), length 40)
    app-profile-7c9457bb6c-trn4x.32782 > 172.16.58.14.3306: Flags [.], cksum 0xf552 (incorrect -> 0xdc5d), seq 225, ack 2465, win 501, length 0
12:02:43.245176 IP (tos 0x0, ttl 64, id 32734, offset 0, flags [DF], proto TCP (6), length 49)
    app-profile-7c9457bb6c-trn4x.32782 > 172.16.58.14.3306: Flags [P.], cksum 0xf55b (incorrect -> 0xbe4b), seq 225:234, ack 2465, win 501, length 9
12:02:43.245362 IP (tos 0x0, ttl 64, id 32735, offset 0, flags [DF], proto TCP (6), length 114)
    app-profile-7c9457bb6c-trn4x.32782 > 172.16.58.14.3306: Flags [P.], cksum 0xf59c (incorrect -> 0x2d1f), seq 234:308, ack 2465, win 501, length 74
12:02:43.246138 IP (tos 0x0, ttl 64, id 32736, offset 0, flags [DF], proto TCP (6), length 40)
    app-profile-7c9457bb6c-trn4x.32782 > 172.16.58.14.3306: Flags [.], cksum 0xf552 (incorrect -> 0xd750), seq 308, ack 3675, win 501, length 0
12:02:43.246242 IP (tos 0x0, ttl 64, id 32737, offset 0, flags [DF], proto TCP (6), length 82)
    app-profile-7c9457bb6c-trn4x.32782 > 172.16.58.14.3306: Flags [P.], cksum 0xf57c (incorrect -> 0x3722), seq 308:350, ack 3675, win 501, length 42
12:02:43.247109 IP (tos 0x0, ttl 64, id 32738, offset 0, flags [DF], proto TCP (6), length 40)
    app-profile-7c9457bb6c-trn4x.32782 > 172.16.58.14.3306: Flags [.], cksum 0xf552 (incorrect -> 0xd2ad), seq 350, ack 4820, win 501, length 0
12:02:43.247198 IP (tos 0x0, ttl 64, id 32739, offset 0, flags [DF], proto TCP (6), length 49)
    app-profile-7c9457bb6c-trn4x.32782 > 172.16.58.14.3306: Flags [P.], cksum 0xf55b (incorrect -> 0xb49a), seq 350:359, ack 4820, win 501, length 9
12:02:48.248354 IP (tos 0x0, ttl 64, id 32740, offset 0, flags [DF], proto TCP (6), length 114)
    app-profile-7c9457bb6c-trn4x.32782 > 172.16.58.14.3306: Flags [P.], cksum 0xf59c (incorrect -> 0x236f), seq 359:433, ack 4820, win 501, length 74
12:02:48.249196 IP (tos 0x0, ttl 64, id 32741, offset 0, flags [DF], proto TCP (6), length 40)
    app-profile-7c9457bb6c-trn4x.32782 > 172.16.58.14.3306: Flags [.], cksum 0xf552 (incorrect -> 0xcda0), seq 433, ack 6030, win 501, length 0
12:02:48.249331 IP (tos 0x0, ttl 64, id 32742, offset 0, flags [DF], proto TCP (6), length 82)
    app-profile-7c9457bb6c-trn4x.32782 > 172.16.58.14.3306: Flags [P.], cksum 0xf57c (incorrect -> 0x2c71), seq 433:475, ack 6030, win 501, length 42
12:02:48.250175 IP (tos 0x0, ttl 64, id 32743, offset 0, flags [DF], proto TCP (6), length 40)
    app-profile-7c9457bb6c-trn4x.32782 > 172.16.58.14.3306: Flags [.], cksum 0xf552 (incorrect -> 0xc8fd), seq 475, ack 7175, win 501, length 0
12:02:48.250304 IP (tos 0x0, ttl 64, id 32744, offset 0, flags [DF], proto TCP (6), length 49)
    app-profile-7c9457bb6c-trn4x.32782 > 172.16.58.14.3306: Flags [P.], cksum 0xf55b (incorrect -> 0xaae9), seq 475:484, ack 7175, win 501, length 9
12:02:48.250504 IP (tos 0x0, ttl 64, id 32745, offset 0, flags [DF], proto TCP (6), length 114)
    app-profile-7c9457bb6c-trn4x.32782 > 172.16.58.14.3306: Flags [P.], cksum 0xf59c (incorrect -> 0x19bf), seq 484:558, ack 7175, win 501, length 74
12:02:48.251283 IP (tos 0x0, ttl 64, id 32746, offset 0, flags [DF], proto TCP (6), length 40)
    app-profile-7c9457bb6c-trn4x.32782 > 172.16.58.14.3306: Flags [.], cksum 0xf552 (incorrect -> 0xc3f0), seq 558, ack 8385, win 501, length 0
12:02:48.251408 IP (tos 0x0, ttl 64, id 32747, offset 0, flags [DF], proto TCP (6), length 82)
    app-profile-7c9457bb6c-trn4x.32782 > 172.16.58.14.3306: Flags [P.], cksum 0xf57c (incorrect -> 0x23c0), seq 558:600, ack 8385, win 501, length 42
12:02:48.252244 IP (tos 0x0, ttl 64, id 32748, offset 0, flags [DF], proto TCP (6), length 40)
    app-profile-7c9457bb6c-trn4x.32782 > 172.16.58.14.3306: Flags [.], cksum 0xf552 (incorrect -> 0xbf4d), seq 600, ack 9530, win 501, length 0
12:02:48.252352 IP (tos 0x0, ttl 64, id 32749, offset 0, flags [DF], proto TCP (6), length 49)
    app-profile-7c9457bb6c-trn4x.32782 > 172.16.58.14.3306: Flags [P.], cksum 0xf55b (incorrect -> 0xa138), seq 600:609, ack 9530, win 501, length 9
x^C
40 packets captured
40 packets received by filter
0 packets dropped by kerne
```

![image](https://user-images.githubusercontent.com/22409551/182604295-afe9b371-344a-4379-810e-1b366468cc94.png)
![image](https://user-images.githubusercontent.com/22409551/182604374-dc6cdf44-cae5-4699-93e3-15f10041baf0.png)

**Comment by sharang** [comment]
before this issue, we only support 4 mysql commands:
- MYSQL_COM_QUERY
- MYSQL_COM_QUIT
- MYSQL_COM_FIELD_LIST
- MYSQL_COM_INIT_DB

PR #539 supports the following 3 commands:
- **MYSQL_COM_STMT_PREPARE**
- **MYSQL_COM_STMT_EXECUTE**
- **MYSQL_COM_STMT_FETCH_AND_CLOSE**

**Comment by sharang** [comment]
There are many more commands that we need to support in future versions

[MySQL - Connection Lifecycle - Command Phase](https://dev.mysql.com/doc/dev/mysql-server/latest/page_protocol_command_phase.html):

- Text Protocol
  - [x] COM_QUERY
- Utility Commands
  - [x] COM_QUIT
  - [x] COM_INIT_DB
  - [x] COM_FIELD_LIST
  - [ ] COM_REFRESH
  - [ ] COM_STATISTICS
  - [ ] COM_PROCESS_INFO
  - [ ] COM_PROCESS_KILL
  - [ ] COM_DEBUG
  - [ ] COM_PING
  - [ ] COM_CHANGE_USER
  - [ ] COM_RESET_CONNECTION
  - [ ] COM_SET_OPTION
- Prepared Statements
  - [x] COM_STMT_PREPARE
  - [x] COM_STMT_EXECUTE
  - [x] COM_STMT_FETCH
  - [x] COM_STMT_CLOSE
  - [ ] COM_STMT_RESET
  - [ ] COM_STMT_SEND_LONG_DATA
- Stored Programs
  - [ ] Multi-Resultset
  - [ ] Multi-Statement

**Comment by sharang** [comment]
> There are many more commands that we need to support in future versions
> 
> [MySQL - Connection Lifecycle - Command Phase](https://dev.mysql.com/doc/dev/mysql-server/latest/page_protocol_command_phase.html):
> 
> * Text Protocol
>   
>   * [x]  COM_QUERY
> * Utility Commands
>   
>   * [x]  COM_QUIT
>   * [x]  COM_INIT_DB
>   * [x]  COM_FIELD_LIST
>   * [ ]  COM_REFRESH
>   * [ ]  COM_STATISTICS
>   * [ ]  COM_PROCESS_INFO
>   * [ ]  COM_PROCESS_KILL
>   * [ ]  COM_DEBUG
>   * [ ]  COM_PING
>   * [ ]  COM_CHANGE_USER
>   * [ ]  COM_RESET_CONNECTION
>   * [ ]  COM_SET_OPTION
> * Prepared Statements
>   
>   * [x]  COM_STMT_PREPARE
>   * [x]  COM_STMT_EXECUTE
>   * [x]  COM_STMT_FETCH
>   * [x]  COM_STMT_CLOSE
>   * [ ]  COM_STMT_RESET
>   * [ ]  COM_STMT_SEND_LONG_DATA
> * Stored Programs
>   
>   * [ ]  Multi-Resultset
>   * [ ]  Multi-Statement

these uncommon commands will be supported on demannd
